{
  "id": "example-weather",
  "name": "Weather",
  "description": "Example weather widget showing current conditions (demonstrates env var interpolation)",
  "version": "1.0.0",
  "author": "Claw Dashboard Team",
  "category": "example",
  "type": "widget",
  "lazyLoad": true,
  "priority": 100,
  "config": {
    "__version": "1.0.0",
    "apiKey": "${WEATHER_API_KEY:-demo-key}",
    "location": "${WEATHER_LOCATION:-New York}",
    "unit": "${WEATHER_UNIT:-celsius}",
    "refreshInterval": 300000,
    "baseUrl": "${WEATHER_API_URL:-https://api.weather.example.com}"
  }
}
